Role,Message,Timestamp
ai,I'm here and ready to listen. How have you been feeling lately?,2025-07-13 13:46:44
user,how is it going lately ,2025-07-13 13:46:43
ai,"That sounds like a beautiful and calming experience. Nature has a way of soothing our minds and bringing a sense of peace. The gentle breeze can be so comforting, almost like a loving embrace from the world around us. I'm glad you were able to enjoy such a serene moment in the park. If you ever need to talk more about your experience or anything else, I'm here to listen.",2025-07-13 13:42:34
user,i had a meditation experience in a park and the wind is quite cozy make me feel really comfortable ,2025-07-13 13:42:33
ai,I'm here for you. How are you feeling today?,2025-07-13 13:41:53
user,how is it going ,2025-07-13 13:41:52
